{
  "domain": "political_science",
  "title": "Political Science",
  "generatedAt": "2026-06-02T21:23:04.042Z",
  "target": 350,
  "sources": [
    {
      "name": "Wikipedia Glossary of Political Science",
      "url": "https://en.wikipedia.org/wiki/Glossary_of_political_science",
      "status": "failed:404",
      "count": 0
    },
    {
      "name": "Wikipedia Outline of Political Science",
      "url": "https://en.wikipedia.org/wiki/Outline_of_political_science",
      "status": "ok",
      "count": 1036
    }
  ],
  "terms": [
    {
      "id": "a_theory_of_justice",
      "title": "A Theory of Justice",
      "domain": "political_science",
      "subdomains": [
        "political_theory"
      ],
      "aliases": [],
      "sourceNames": [
        "Wikipedia Outline of Political Science"
      ],
      "sourceUrls": [
        "https://en.wikipedia.org/wiki/Outline_of_political_science"
      ],
      "status": "candidate",
      "promoted": false
    },
    {
      "id": "abkhazia",
      "title": "Abkhazia",
      "domain": "political_science",
      "subdomains": [],
      "aliases": [],
      "sourceNames": [
        "Wikipedia Outline of Political Science"
      ],
      "sourceUrls": [
        "https://en.wikipedia.org/wiki/Outline_of_political_science"
      ],
      "status": "candidate",
      "promoted": false
    },
    {
      "id": "abortion_law",
      "title": "Abortion law",
      "domain": "political_science",
      "subdomains": [
        "law"
      ],
      "aliases": [],
      "sourceNames": [
        "Wikipedia Outline of Political Science"
      ],
      "sourceUrls": [
        "https://en.wikipedia.org/wiki/Outline_of_political_science"
      ],
      "status": "candidate",
      "promoted": false
    },
    {
      "id": "absolute_monarchy",
      "title": "Absolute monarchy",
      "domain": "political_science",
      "subdomains": [],
      "aliases": [],
      "sourceNames": [
        "Wikipedia Outline of Political Science"
      ],
      "sourceUrls": [
        "https://en.wikipedia.org/wiki/Outline_of_political_science"
      ],
      "status": "candidate",
      "promoted": false
    },
    {
      "id": "absolutism",
      "title": "Absolutism",
      "domain": "political_science",
      "subdomains": [],
      "aliases": [],
      "sourceNames": [
        "Wikipedia Outline of Political Science"
      ],
      "sourceUrls": [
        "https://en.wikipedia.org/wiki/Outline_of_political_science"
      ],
      "status": "candidate",
      "promoted": false
    },
    {
      "id": "abstention",
      "title": "Abstention",
      "domain": "political_science",
      "subdomains": [],
      "aliases": [],
      "sourceNames": [
        "Wikipedia Outline of Political Science"
      ],
      "sourceUrls": [
        "https://en.wikipedia.org/wiki/Outline_of_political_science"
      ],
      "status": "candidate",
      "promoted": false
    },
    {
      "id": "abstentionism",
      "title": "Abstentionism",
      "domain": "political_science",
      "subdomains": [],
      "aliases": [],
      "sourceNames": [
        "Wikipedia Outline of Political Science"
      ],
      "sourceUrls": [
        "https://en.wikipedia.org/wiki/Outline_of_political_science"
      ],
      "status": "candidate",
      "promoted": false
    },
    {
      "id": "accelerationism",
      "title": "Accelerationism",
      "domain": "political_science",
      "subdomains": [],
      "aliases": [],
      "sourceNames": [
        "Wikipedia Outline of Political Science"
      ],
      "sourceUrls": [
        "https://en.wikipedia.org/wiki/Outline_of_political_science"
      ],
      "status": "candidate",
      "promoted": false
    },
    {
      "id": "adam_smith",
      "title": "Adam Smith",
      "domain": "political_science",
      "subdomains": [],
      "aliases": [],
      "sourceNames": [
        "Wikipedia Outline of Political Science"
      ],
      "sourceUrls": [
        "https://en.wikipedia.org/wiki/Outline_of_political_science"
      ],
      "status": "candidate",
      "promoted": false
    },
    {
      "id": "adhocracy",
      "title": "Adhocracy",
      "domain": "political_science",
      "subdomains": [],
      "aliases": [],
      "sourceNames": [
        "Wikipedia Outline of Political Science"
      ],
      "sourceUrls": [
        "https://en.wikipedia.org/wiki/Outline_of_political_science"
      ],
      "status": "candidate",
      "promoted": false
    },
    {
      "id": "affirmative_action",
      "title": "Affirmative action",
      "domain": "political_science",
      "subdomains": [],
      "aliases": [],
      "sourceNames": [
        "Wikipedia Outline of Political Science"
      ],
      "sourceUrls": [
        "https://en.wikipedia.org/wiki/Outline_of_political_science"
      ],
      "status": "candidate",
      "promoted": false
    },
    {
      "id": "afghanistan",
      "title": "Afghanistan",
      "domain": "political_science",
      "subdomains": [],
      "aliases": [],
      "sourceNames": [
        "Wikipedia Outline of Political Science"
      ],
      "sourceUrls": [
        "https://en.wikipedia.org/wiki/Outline_of_political_science"
      ],
      "status": "candidate",
      "promoted": false
    },
    {
      "id": "age_of_candidacy",
      "title": "Age of candidacy",
      "domain": "political_science",
      "subdomains": [],
      "aliases": [],
      "sourceNames": [
        "Wikipedia Outline of Political Science"
      ],
      "sourceUrls": [
        "https://en.wikipedia.org/wiki/Outline_of_political_science"
      ],
      "status": "candidate",
      "promoted": false
    },
    {
      "id": "aggressionism",
      "title": "Aggressionism",
      "domain": "political_science",
      "subdomains": [],
      "aliases": [],
      "sourceNames": [
        "Wikipedia Outline of Political Science"
      ],
      "sourceUrls": [
        "https://en.wikipedia.org/wiki/Outline_of_political_science"
      ],
      "status": "candidate",
      "promoted": false
    },
    {
      "id": "agrarian_socialism",
      "title": "Agrarian socialism",
      "domain": "political_science",
      "subdomains": [],
      "aliases": [],
      "sourceNames": [
        "Wikipedia Outline of Political Science"
      ],
      "sourceUrls": [
        "https://en.wikipedia.org/wiki/Outline_of_political_science"
      ],
      "status": "candidate",
      "promoted": false
    },
    {
      "id": "agricultural_policy",
      "title": "Agricultural policy",
      "domain": "political_science",
      "subdomains": [
        "public_policy"
      ],
      "aliases": [],
      "sourceNames": [
        "Wikipedia Outline of Political Science"
      ],
      "sourceUrls": [
        "https://en.wikipedia.org/wiki/Outline_of_political_science"
      ],
      "status": "candidate",
      "promoted": false
    },
    {
      "id": "agricultural_subsidy",
      "title": "Agricultural subsidy",
      "domain": "political_science",
      "subdomains": [],
      "aliases": [],
      "sourceNames": [
        "Wikipedia Outline of Political Science"
      ],
      "sourceUrls": [
        "https://en.wikipedia.org/wiki/Outline_of_political_science"
      ],
      "status": "candidate",
      "promoted": false
    },
    {
      "id": "aland",
      "title": "Åland",
      "domain": "political_science",
      "subdomains": [],
      "aliases": [],
      "sourceNames": [
        "Wikipedia Outline of Political Science"
      ],
      "sourceUrls": [
        "https://en.wikipedia.org/wiki/Outline_of_political_science"
      ],
      "status": "candidate",
      "promoted": false
    },
    {
      "id": "albania",
      "title": "Albania",
      "domain": "political_science",
      "subdomains": [],
      "aliases": [],
      "sourceNames": [
        "Wikipedia Outline of Political Science"
      ],
      "sourceUrls": [
        "https://en.wikipedia.org/wiki/Outline_of_political_science"
      ],
      "status": "candidate",
      "promoted": false
    },
    {
      "id": "algeria",
      "title": "Algeria",
      "domain": "political_science",
      "subdomains": [],
      "aliases": [],
      "sourceNames": [
        "Wikipedia Outline of Political Science"
      ],
      "sourceUrls": [
        "https://en.wikipedia.org/wiki/Outline_of_political_science"
      ],
      "status": "candidate",
      "promoted": false
    },
    {
      "id": "alt_right",
      "title": "Alt-right",
      "domain": "political_science",
      "subdomains": [],
      "aliases": [],
      "sourceNames": [
        "Wikipedia Outline of Political Science"
      ],
      "sourceUrls": [
        "https://en.wikipedia.org/wiki/Outline_of_political_science"
      ],
      "status": "candidate",
      "promoted": false
    },
    {
      "id": "alternative_vote_plus",
      "title": "Alternative vote plus",
      "domain": "political_science",
      "subdomains": [],
      "aliases": [],
      "sourceNames": [
        "Wikipedia Outline of Political Science"
      ],
      "sourceUrls": [
        "https://en.wikipedia.org/wiki/Outline_of_political_science"
      ],
      "status": "candidate",
      "promoted": false
    },
    {
      "id": "altruism_theory_of_voting",
      "title": "Altruism theory of voting",
      "domain": "political_science",
      "subdomains": [
        "political_theory"
      ],
      "aliases": [],
      "sourceNames": [
        "Wikipedia Outline of Political Science"
      ],
      "sourceUrls": [
        "https://en.wikipedia.org/wiki/Outline_of_political_science"
      ],
      "status": "candidate",
      "promoted": false
    },
    {
      "id": "american_samoa",
      "title": "American Samoa",
      "domain": "political_science",
      "subdomains": [],
      "aliases": [],
      "sourceNames": [
        "Wikipedia Outline of Political Science"
      ],
      "sourceUrls": [
        "https://en.wikipedia.org/wiki/Outline_of_political_science"
      ],